source_url,publisher_domain,headline,snippet,date_discovered,publisher_name,date_published,author_name,origin_country,destination_country,deportee_count,deportee_count_is_estimate,deportee_count_low,deportee_count_high,conducting_agency,transport_mode,cse_query
https://www.cbp.gov/newsroom/local-media-release/us-border-patrol-weekly-blotter-blaine-sector-0,www.cbp.gov,"U.S. Border Patrol Weekly Blotter, Blaine Sector | U.S. Customs and ...","The two individuals, determined to be illegally present in the United States, were placed under arrest and processed for removal. 02/02/2012 - Remote Video ...",2025-08-30T16:26:31.928073Z,U.S. Customs and Border Protection,,,United States,,2.0,False,,,ICE,unknown,site:cbp.gov removal OR deport*
https://www.cbp.gov/sites/default/files/documents/Glossary%20of%20Terms.pdf,www.cbp.gov,Customs-Trade Partnership Against Terrorism,"In accordance with the SAFE Port Act, a Partner has the right to respond to an action taken by the C-TPAT program which has resulted in the removal of benefits.",2025-08-30T16:26:31.928073Z,www.cbp.gov,,,United States,,,False,,,CBP,ship,site:cbp.gov removal OR deport*
https://www.cbp.gov/newsroom/local-media-release/cbp-arrests-deported-spanish-man-attempting-enter-using-visa-waiver,www.cbp.gov,CBP arrests deported Spanish man attempting to enter using the ...,"Feb 12, 2016 ... Referred to secondary inspection, a biometric database revealed a prior removal, and was later denied admission into the United States under the ...",2025-08-30T16:26:31.928073Z,U.S. Customs and Border Protection,,,United States,,,False,,,CBP,unknown,site:cbp.gov removal OR deport*
https://www.cbp.gov/newsroom/stats/trade/withhold-release-orders-findings-dashboard,www.cbp.gov,Withhold Release Orders & Findings Dashboard | U.S. Customs and ...,"Jul 15, 2025 ... ... removal, or modification of WROs and Findings. Note: The below charts are fully interactive. Clicking on chart elements will result in data ...",2025-08-30T16:26:31.928073Z,U.S. Customs and Border Protection,,,United States,,15.0,False,,,ICE,unknown,site:cbp.gov removal OR deport*
https://www.cbp.gov/newsroom/local-media-release/us-border-patrol-weekly-blotter-blaine-sector-apr-05-apr-11,www.cbp.gov,"U.S. Border Patrol Weekly Blotter, Blaine Sector Apr. 05 - Apr. 11 ...","... Lynden, Washington. The subjects, all citizens of Mexico illegally present in the United States, were placed under arrest and processed for removal.",2025-08-30T16:26:31.928073Z,U.S. Customs and Border Protection,,,United States,,,False,,,ICE,unknown,site:cbp.gov removal OR deport*
https://www.cbp.gov/newsroom/local-media-release/border-patrol-agents-arrest-confirmed-gang-member-maine,www.cbp.gov,Border Patrol Agents Arrest Confirmed Gang Member in Maine | U.S. ...,"Aug 5, 2025 ... The subject is currently being transferred to U.S. Immigration and Customs Enforcement (ICE) Enforcement and Removal Operations (ERO) for ...",2025-08-30T16:26:34.013114Z,U.S. Customs and Border Protection,,,United States,,,False,,,ICE,unknown,site:cbp.gov removal OR deport*
https://rulings.cbp.gov/ruling/H287418,rulings.cbp.gov,CROSS Ruling,Re: Coastwise transportation; Salvage; Vessel removal; Outer Continental Shelf; 43 U.S.C. § 1333(a); 46 U.S.C. §§ 55102(b) and 80104; 19 C.F.R. § 4.97(a); 33 ...,2025-08-30T16:26:34.013114Z,rulings.cbp.gov,,,United States,,43.0,False,,,CBP,ship,site:cbp.gov removal OR deport*
https://www.cbp.gov/sites/default/files/2025-06/25_0618_cbp-home-terms-conditions.pdf,www.cbp.gov,CBP Home Terms and Conditions,CBP Home is a way for illegal aliens to submit their intent to self-deport and self-report their exit from the United States. CBP Home allows information to ...,2025-08-30T16:26:34.013114Z,www.cbp.gov,,USCBP,United States,,,False,,,CBP,unknown,site:cbp.gov removal OR deport*
https://www.cbp.gov/newsroom/national-media-release/cbp-meet-legal-requirement-collect-dna-samples-certain-populations,www.cbp.gov,CBP to Meet Legal Requirement to Collect DNA Samples from ...,"Dec 3, 2020 ... ... removal; or a U.S. citizen wanted on a federal warrant. CBP is NOT collecting DNA from persons encountered under the following circumstances ...",2025-08-30T16:26:34.013114Z,U.S. Customs and Border Protection,,,United States,,3.0,False,,,CBP,unknown,site:cbp.gov removal OR deport*
https://www.cbp.gov/newsroom/local-media-release/five-stowaways-apprehended-cbp-officers-philadelphia,www.cbp.gov,Five Stowaways Apprehended by CBP Officers in Philadelphia | U.S. ...,"Jul 27, 2021 ... The subjects were cleared medically and have been turned over to ICE Enforcement and Removal Operations to begin removal processing of the ...",2025-08-30T16:26:34.013114Z,U.S. Customs and Border Protection,,,United States,,,False,,,ICE,unknown,site:cbp.gov removal OR deport*
https://www.cbp.gov/newsroom/local-media-release/border-patrol-arrests-el-salvadoran-citizen-maine,www.cbp.gov,Border Patrol Arrests El Salvadoran Citizen in Maine | U.S. Customs ...,"Jul 8, 2020 ... The subject was processed for removal and turned over to Immigration and Customs Enforcement (ICE) Enforcement and Removal Office. “Border ...",2025-08-30T16:26:34.013114Z,U.S. Customs and Border Protection,,,United States,,8.0,False,,,ICE,unknown,site:cbp.gov removal OR deport*
https://www.cbp.gov/sites/default/files/2024-05/SUMMARY_OF_CHANGES_5_21_2024%20%28v4.1%29_508c.pdf,www.cbp.gov,AESTIR Summary of Changes v4.1,"May 15, 2024 ... REMOVAL OF EXPORT PORT CODE 4117 FROM APPENDIX D. •. REMOVAL OF THE APID FROM ERROR RESPONSE CODES 057, 058,. 059, 060, 423, 424 & 426 IN ...",2025-08-30T16:26:34.013114Z,www.cbp.gov,,US CBP,United States,,1.0,False,,,CBP,unknown,site:cbp.gov removal OR deport*
https://rulings.cbp.gov/ruling/N275579,rulings.cbp.gov,CROSS Ruling,"The Wart Zapper is a pen-style, galvanic device encased in an aluminum housing. It is used for the in-home treatment /removal of warts through electrolysis or ...",2025-08-30T16:26:34.013114Z,rulings.cbp.gov,,,United States,,,False,,,ICE,unknown,site:cbp.gov removal OR deport*
https://www.cbp.gov/document/foia-record/catch-and-release-policy,www.cbp.gov,Catch and Release Policy | U.S. Customs and Border Protection,"Aug 4, 2025 ... Absent extenuating factors, CBP personnel should leverage the legal authorities that facilitate removal in the most efficient manner possible.",2025-08-30T16:26:34.013114Z,U.S. Customs and Border Protection,,,United States,,,False,,,CBP,unknown,site:cbp.gov removal OR deport*
https://www.cbp.gov/newsroom/record/border-patrol-arrests-convicted-felons-capac,www.cbp.gov,Border Patrol Arrests Convicted Felons in Capac | U.S. Customs and ...,"Dec 15, 2022 ... ... removal proceedings at the conclusion of their criminal cases. Anyone with information on suspicious activity is asked to call the Detroit ...",2025-08-30T16:26:34.013114Z,U.S. Customs and Border Protection,,,United States,,15.0,False,,,ICE,unknown,site:cbp.gov removal OR deport*
https://www.cbp.gov/newsroom/national-media-release/cbp-announces-new-cbp-link-mobile-app,www.cbp.gov,CBP announces new CBP Link mobile app | U.S. Customs and ...,"Jun 16, 2025 ... Those who use the CBP Home mobile app to self-deport receive cost-free travel, forgiveness of any civil fines or penalties for failing to ...",2025-08-30T16:26:36.258039Z,U.S. Customs and Border Protection,,,United States,,,False,,,CBP,unknown,site:cbp.gov removal OR deport*
https://www.cbp.gov/document/guidance/migrant-protection-protocols-mpp,www.cbp.gov,Migrant Protection Protocols (MPP) | U.S. Customs and Border ...,"Dec 17, 2021 ... MPP Guiding Principles, Prioritization of Removal Pathways, Migrant Protection Protocols Standard Operating Procedures, Correspondence, ...",2025-08-30T16:26:36.258039Z,U.S. Customs and Border Protection,,,United States,,21.0,False,,,ICE,unknown,site:cbp.gov removal OR deport*
https://www.cbp.gov/newsroom/national-media-release/cbp-releases-june-2024-monthly-update,www.cbp.gov,CBP Releases June 2024 Monthly Update | U.S. Customs and ...,"Jul 15, 2024 ... * Total removals and returns over the past year exceed removals and returns in any fiscal year since 2010 and a majority of all southwest border ...",2025-08-30T16:26:36.258039Z,U.S. Customs and Border Protection,,,United States,,15.0,False,,,CBP,unknown,site:cbp.gov removal OR deport*
https://www.cbp.gov/newsroom/national-media-release/cbp-releases-september-2024-monthly-update,www.cbp.gov,CBP Releases September 2024 Monthly Update | U.S. Customs and ...,"Oct 22, 2024 ... ... removal from the United States. DHS has also returned more Border Patrol agents to the field to undertake front line border security ...",2025-08-30T16:26:36.258039Z,U.S. Customs and Border Protection,,,United States,,22.0,False,,,DHS,unknown,site:cbp.gov removal OR deport*
https://careers.cbp.gov/s/career-paths/usbp/bppc,careers.cbp.gov,Border Patrol Processing Coordinator | CBP Careers,"Communicating in the Spanish language; maintaining contact with other sectors, stations, agencies and foreign consulates and making arrangements for removal ...",2025-08-30T16:26:36.258039Z,careers.cbp.gov,,,United States,,,False,,,CBP,unknown,site:cbp.gov removal OR deport*
https://www.cbp.gov/sites/default/files/documents/FTZmanual2011.pdf,www.cbp.gov,OMB No. 1651-0051 Expiration Date: 4/30/2014 U.S. Customs and ...,"The purpose of the Foreign Trade Zone Manual is to place in one document, the various laws, regulations, policies and procedures that Customs and Border ...",2025-08-30T16:26:36.258039Z,www.cbp.gov,,Authorized User,United States,,,False,,,CBP,unknown,site:cbp.gov removal OR deport*
https://www.cbp.gov/newsroom/local-media-release/cbp-arrest-5-previously-removed-aliens-found-stowaways-inside-barge,www.cbp.gov,CBP arrest 5 previously removed aliens found as stowaways inside ...,"Feb 4, 2025 ... ... removal, charging: (1) Nicauri Rodriguez Melo, (2) Julio Campana Damaso, (3) Joel Baez Marte, (4) Anthony Junior Solano, and (5) Silverio ...",2025-08-30T16:26:36.258039Z,U.S. Customs and Border Protection,,,United States,,5.0,False,,,CBP,unknown,site:cbp.gov removal OR deport*
https://www.cbp.gov/newsroom/local-media-release/border-patrol-agents-apprehend-sex-offender-convicted-felon,www.cbp.gov,"Border Patrol agents apprehend sex offender, convicted felon | U.S. ...","Apr 27, 2021 ... Perez-Diaz's most recent removal from the U.S. was March 22 through the Calexico, California Port of Entry. Perez-Diaz will face re-entry ...",2025-08-30T16:26:36.258039Z,U.S. Customs and Border Protection,,,United States,,27.0,False,,,ICE,unknown,site:cbp.gov removal OR deport*
https://careers.cbp.gov/s/career-paths/amo/aea,careers.cbp.gov,Aviation Enforcement Agent | CBP Careers,"Aviation Enforcement Agents. conduct airborne law enforcement operations including anti-terrorism detection, interdiction and apprehension to protect the ...",2025-08-30T16:26:36.258039Z,careers.cbp.gov,,,United States,,,False,,,CBP,unknown,site:cbp.gov removal OR deport*
https://www.cbp.gov/newsroom/national-media-release/us-border-patrol-assists-bureau-land-management-near-lake-cushman,www.cbp.gov,U.S. Border Patrol assists Bureau of Land Management near Lake ...,2 days ago ... ... removal. The two individuals were arrested and transported to the Bellingham Station on charges of illegal entry and 8 US Code § 1326 ...,2025-08-30T16:26:36.258039Z,U.S. Customs and Border Protection,,,United States,,2.0,False,,,ICE,unknown,site:cbp.gov removal OR deport*
https://pe.usembassy.gov/dhs-announces-historic-travel-assistance-and-stipend-for-voluntary-self-deportation/,pe.usembassy.gov,DHS Announces Historic Travel Assistance and Stipend for ...,"May 5, 2025 ... Self-deportation is a dignified way to leave the U.S. and will allow illegal aliens to avoid being encountered by U.S. Immigration and Customs ...",2025-08-30T16:26:38.368125Z,U.S. Embassy in Peru,2025-05-05T19:09:42+00:00,U.S. Mission Lima,United States,,5.0,False,,,DHS,unknown,site:usembassy.gov deport* OR removal
https://jp.usembassy.gov/services/sentencing-deportation/,jp.usembassy.gov,Sentencing/Deportation - U.S. Embassy & Consulates in Japan,"Even if you are released after receiving a suspended sentence, you may not be able to renew your immigration status later, and eventually may be deported. Those ...",2025-08-30T16:26:38.368125Z,U.S. Embassy & Consulates in Japan,,,United States,,,False,,,ICE,unknown,site:usembassy.gov deport* OR removal
https://mx.usembassy.gov/dhs-issues-notices-of-termination-for-the-chnv-parole-program-encourages-parolees-to-self-deport-immediately/,mx.usembassy.gov,DHS Issues Notices of Termination for the CHNV Parole Program ...,"Jun 12, 2025 ... DHS issues notices of termination for the CHNV parole program, encourages parolees to self-deport immediately.",2025-08-30T16:26:38.368125Z,U.S. Embassy & Consulates in Mexico,2025-06-12T21:47:27+00:00,U.S. Mission to Mexico,United States,,,False,,,ICE,unknown,site:usembassy.gov deport* OR removal
https://pa.usembassy.gov/u-s-panama-migration-mou-facilitates-48-deportation-flights-of-illegal-migrants/,pa.usembassy.gov,U.S.-Panama Migration MOU Facilitates 48 Deportation Flights of ...,"May 6, 2025 ... Today, a charter flight supported through the program departed from Panama, deporting 81 illegal migrants from Cameroon, Nepal, India, ...",2025-08-30T16:26:38.368125Z,U.S. Embassy in Panama,2025-05-07T02:01:55+00:00,U.S. Mission Panama,United States,,48.0,False,,,ERO,charter_flight,site:usembassy.gov deport* OR removal
https://ht.usembassy.gov/deportation-actions-against-u-s-legal-permanent-residents-affiliated-with-haitian-foreign-terrorist-organization-viv-ansanm/,ht.usembassy.gov,Deportation Actions Against U.S. Legal Permanent Residents ...,"Jul 21, 2025 ... The Department of State has determined that certain individuals with US lawful permanent resident status have supported and collaborated with Haitian gang ...",2025-08-30T16:26:38.368125Z,U.S. Embassy in Haiti,2025-07-21T21:58:18+00:00,,United States,,21.0,False,,,ICE,unknown,site:usembassy.gov deport* OR removal
https://ua.usembassy.gov/tag/deportation/,ua.usembassy.gov,deportation архив - U.S. Embassy in Ukraine,The United States calls on Russia to immediately halt its systematic “filtration” operations and forced deportations in Russian-controlled and held areas of ...,2025-08-30T16:26:38.368125Z,U.S. Embassy in Ukraine,,,United States,,,False,,,ICE,unknown,site:usembassy.gov deport* OR removal
https://mx.usembassy.gov/u-s-immigration-and-customs-enforcement/,mx.usembassy.gov,U.S. Immigration and Customs Enforcement - U.S. Embassy ...,"Mar 16, 2021 ... ... deported or removed from the United States. The ICE Attaché Mexico City is responsible for: Coordinating criminal and administrative ...",2025-08-30T16:26:38.368125Z,U.S. Embassy & Consulates in Mexico,2021-03-16T17:54:13+00:00,mcanultyso,United States,,16.0,False,,,ICE,unknown,site:usembassy.gov deport* OR removal
https://tt.usembassy.gov/joint-effort-between-u-s-authorities-and-trinidad-and-tobago-facilitates-deportation-charter-flight/,tt.usembassy.gov,Joint Effort Between U.S. Authorities and Trinidad and Tobago ...,"Jun 13, 2025 ... Customs and Border Protection, and Diplomatic Security Service special agents facilitate the arrival of a deportation charter flight with ...",2025-08-30T16:26:38.368125Z,U.S. Embassy in Trinidad & Tobago,2025-06-13T14:06:18+00:00,U.S. Embassy Trinidad & Tobago,United States,,,False,,,ICE,charter_flight,site:usembassy.gov deport* OR removal
https://uy.usembassy.gov/deportation-voluntary-departure/,uy.usembassy.gov,Deportation - Voluntary Departure - U.S. Embassy in Uruguay,Deportation – Voluntary Departure · 1.One of the following DHS/ICE forms: · 2.Proof of travel dates: · 3.The passport used to exit the United States:.,2025-08-30T16:26:38.368125Z,U.S. Embassy in Uruguay,,,United States,,1.0,False,,,ICE,unknown,site:usembassy.gov deport* OR removal
https://gy.usembassy.gov/ask-the-consul-june-2025/,gy.usembassy.gov,Ask the Consul - June 2025 - U.S. Embassy in Guyana,"Jun 20, 2025 ... We will provide information on the self-deportation process for individuals who wish to voluntarily leave the United States using the CBP Home Mobile App.",2025-08-30T16:26:38.368125Z,U.S. Embassy in Guyana,2025-06-20T13:30:10+00:00,U.S. Mission Guyana,United States,,2025.0,False,,,CBP,unknown,site:usembassy.gov deport* OR removal
https://cz.usembassy.gov/visas/denied-entry/,cz.usembassy.gov,"Denied Entry, Deported, or Overstayed - U.S. Embassy in The Czech ...","A person who has been deported or removed, may be prohibited from reapplying for a visa depending on the circumstances for up to ten years.",2025-08-30T16:26:40.801817Z,U.S. Embassy in The Czech Republic,,,United States,,,False,,,ICE,unknown,site:usembassy.gov deport* OR removal
https://rw.usembassy.gov/press-release/,rw.usembassy.gov,press releaseThe United States Deports Criminal and Fugitive ...,"Mar 5, 2025 ... DSS has deported Rwandan national Napolean Ahmed Mbonyunkiza and transferred him into the custody of Rwandan authorities.",2025-08-30T16:26:40.801817Z,U.S. Embassy in Rwanda,2025-03-05T05:43:19+00:00,U.S. Embassy in Rwanda,United States,,5.0,False,,,ICE,unknown,site:usembassy.gov deport* OR removal
https://do.usembassy.gov/alert-ongoing-dominican-migration-enforcement/,do.usembassy.gov,Alert: Ongoing Dominican Migration Enforcement - U.S. Embassy in ...,"Nov 19, 2022 ... ... deported to Haiti. Please report any such incidents immediately to the Embassy emergency number (809) 567-7775 and to the Defensor del ...",2025-08-30T16:26:40.801817Z,U.S. Embassy in the Dominican Republic,2022-11-19T15:38:00+00:00,U.S. Embassy Santo Domingo,United States,Haiti,19.0,False,,,ICE,unknown,site:usembassy.gov deport* OR removal
https://jp.usembassy.gov/services/visas-japan-u-s-citizens/,jp.usembassy.gov,Visas to Japan for U.S. Citizens - U.S. Embassy & Consulates in Japan,Persons found working illegally are subject to arrest and deportation. Persons believed to be entering Japan without a working visa but who intend to work ...,2025-08-30T16:26:40.801817Z,U.S. Embassy & Consulates in Japan,,,United States,,,False,,,ICE,unknown,site:usembassy.gov deport* OR removal
https://th.usembassy.gov/u-s-citizen-services/arrest-of-a-u-s-citizen/,th.usembassy.gov,Arrest of a U.S. Citizen - U.S. Embassy & Consulate in Thailand,"Persons violating the law in Thailand, even unknowingly, may be fined, arrested, and/or deported. If detained, a U.S. citizen will have to go through the ...",2025-08-30T16:26:40.801817Z,U.S. Embassy & Consulate in Thailand,,,United States,,,False,,,ICE,unknown,site:usembassy.gov deport* OR removal
https://tt.usembassy.gov/trinidad-and-tobago-and-u-s-law-enforcement-cooperate-on-deportation-charter-flight/,tt.usembassy.gov,Trinidad and Tobago and U.S. Law Enforcement Cooperate on ...,"May 28, 2025 ... ... deportation charter flight at Piarco International Airport. The 17 Trinbagonian deportees, most with significant criminal records, arrived ...",2025-08-30T16:26:40.801817Z,U.S. Embassy in Trinidad & Tobago,2025-05-28T14:43:53+00:00,U.S. Embassy Trinidad & Tobago,United States,,28.0,False,,,ICE,charter_flight,site:usembassy.gov deport* OR removal
https://uz.usembassy.gov/removal-of-uzbekistanis-from-the-united-states-3/,uz.usembassy.gov,Removal of Uzbekistanis from the United States - U.S. Embassy in ...,"May 1, 2025 ... The US government deported over 100 Uzbekistani, Kazakhstani, and Kyrgyzstani citizens present illegally in the United States on a charter flight organized by ...",2025-08-30T16:26:40.801817Z,U.S. Embassy in Uzbekistan,2025-05-01T06:39:13+00:00,U.S. Mission Uzbekistan,United States,,1.0,False,,,ICE,charter_flight,site:usembassy.gov deport* OR removal
https://vn.usembassy.gov/loi-bat-cap-hai-the-risk-isnt-worth-the-reward/,vn.usembassy.gov,Lợi bất cập hại (The risk isn't worth the reward) - U.S. Embassy ...,"May 13, 2025 ... The Trump Administration has strengthened border security and increased the number of illegal immigrants being arrested and deported. These ...",2025-08-30T16:26:40.801817Z,U.S. Embassy & Consulate in Vietnam,2025-05-13T02:40:22+00:00,U.S. Mission Vietnam,United States,,,False,,,ICE,unknown,site:usembassy.gov deport* OR removal
https://ru.usembassy.gov/pursuing-visa-restrictions-to-promote-accountability-for-the-forced-transfer-and-deportation-of-ukraines-children/,ru.usembassy.gov,Pursuing Visa Restrictions to Promote Accountability for the Forced ...,"Dec 5, 2024 ... ... deportation, transfer, and confinement of Ukrainian children. Many of these children have had their identities changed and origins obscured ...",2025-08-30T16:26:40.801817Z,U.S. Embassy & Consulates in Russia,2024-12-05T11:27:00+00:00,U.S. Mission Russia,United States,,5.0,False,,,ICE,unknown,site:usembassy.gov deport* OR removal
https://th.usembassy.gov/security-alert-u-s-embassy-bangkok-thailand/,th.usembassy.gov,"Security Alert - U. S. Embassy Bangkok, Thailand - U.S. Embassy ...","Feb 28, 2025 ... On 27 February 2025, the Royal Thai Government deported a group of 45 Uyghurs asylees to China. Similar deportations have prompted violent retaliatory attacks ...",2025-08-30T16:26:40.801817Z,U.S. Embassy & Consulate in Thailand,2025-02-28T04:13:42+00:00,U.S. Mission Thailand,United States,China,27.0,False,,,ICE,unknown,site:usembassy.gov deport* OR removal
https://ph.usembassy.gov/working-in-the-philippines/,ph.usembassy.gov,Working in the Philippines - U.S. Embassy in the Philippines,"Jan 1, 2022 ... In addition to such penalties, any alien found guilty shall be summarily deported upon completion of service of sentence. Living and Working ...",2025-08-30T16:26:42.897166Z,U.S. Embassy in the Philippines,2021-12-31T23:18:00+00:00,U.S. Embassy Manila,United States,,,False,,,ICE,unknown,site:usembassy.gov deport* OR removal
https://na.usembassy.gov/new-entry-requirements-for-u-s-citizen-tourists-entering-namibia-effective-april-1-2025/,na.usembassy.gov,New Entry Requirements for U.S. Citizen Tourists Entering Namibia ...,"Apr 1, 2025 ... Beginning April 1, 2025, the Namibian Government will require US citizen tourists to obtain a visa prior to entering the country.",2025-08-30T16:26:42.897166Z,U.S. Embassy in Namibia,2025-04-02T14:48:02+00:00,U.S. Embassy Windhoek,United States,,,False,,,ICE,unknown,site:usembassy.gov deport* OR removal
https://et.usembassy.gov/dont-risk-your-future-the-united-states-cracks-down-on-illegal-immigration/,et.usembassy.gov,Don't Risk Your Future: The United States Cracks Down on Illegal ...,"Apr 3, 2025 ... These include jail time, deportation, and a permanent ban on obtaining a U.S. visa in the future. If you have family or friends who are in ...",2025-08-30T16:26:42.897166Z,U.S. Embassy in Ethiopia,2025-04-03T05:25:19+00:00,U.S. Embassy Ethiopia,United States,,3.0,False,,,ICE,unknown,site:usembassy.gov deport* OR removal
https://mn.usembassy.gov/pr-040125/,mn.usembassy.gov,"Op-Ed by Ambassador Buangan: ""The United States Cracks Down ...","Apr 1, 2025 ... The penalties are serious: jail time, separation from your family, deportation, and permanent bans from re-entering the United States. If ...",2025-08-30T16:26:42.897166Z,U.S. Embassy in Mongolia,2025-04-01T00:43:18+00:00,,United States,,,False,,,ICE,unknown,site:usembassy.gov deport* OR removal
https://hn.usembassy.gov/voluntary-departures/,hn.usembassy.gov,Voluntary Departures - U.S. Embassy in Honduras,I-294 Warrant of deportation. G-146 Voluntary departure form. I-210 Voluntary departure and exit verification. Proof of travel dates: Original and copy of ...,2025-08-30T16:26:42.897166Z,U.S. Embassy in Honduras,2024-05-31T00:27:06+00:00,U.S. Mission Tegucigalpa,United States,,294.0,False,,,ICE,unknown,site:usembassy.gov deport* OR removal
https://co.usembassy.gov/first-group-of-colombians-joins-the-cbp-home-program/,co.usembassy.gov,First Group of Colombians Joins the CBP Home Program - U.S. ...,"May 20, 2025 ... ... deport to their home countries, Honduras and Colombia,” said Secretary Kristi Noem. “If you are here illegally, use the CBP Home app to take ...",2025-08-30T16:26:42.897166Z,U.S. Embassy in Colombia,2025-05-20T15:08:17+00:00,U.S. Embassy Bogotá,United States,,20.0,False,,,CBP,unknown,site:usembassy.gov deport* OR removal
https://ec.usembassy.gov/voluntary-departure/,ec.usembassy.gov,Voluntary Departure - U.S. Embassy and Consulate in Ecuador,Failure to depart within the time granted results in a fine and a ten-year bar to several forms of relief from deportation. How to process the Voluntary ...,2025-08-30T16:26:42.897166Z,U.S. Embassy and Consulate in Ecuador,2024-06-21T21:49:08+00:00,U.S. Mission Ecuador,United States,,,False,,,ICE,unknown,site:usembassy.gov deport* OR removal
https://cm.usembassy.gov/dont-risk-your-future-the-united-states-is-cracking-down-on-illegal-immigration/,cm.usembassy.gov,Don't Risk Your Future: The United States is Cracking Down on ...,"Apr 10, 2025 ... penalties. These could include imprisonment, deportation, and a permanent ban on obtaining a U.S. visa in the future. U.S. Visa Fraud Has ...",2025-08-30T16:26:42.897166Z,U.S. Embassy in Cameroon,2025-04-10T15:36:13+00:00,U.S. Embassy in Cameroon,United States,,,False,,,ERO,unknown,site:usembassy.gov deport* OR removal
https://vn.usembassy.gov/president-trumps-america-first-priorities/,vn.usembassy.gov,President Trump's America First Priorities - U.S. Embassy ...,"Jan 22, 2025 ... President Trump's deportation operation will address the record border crossings of criminal aliens under the prior administration. The ...",2025-08-30T16:26:42.897166Z,U.S. Embassy & Consulate in Vietnam,2025-01-22T10:23:08+00:00,U.S. Mission Vietnam,United States,,22.0,False,,,ICE,ship,site:usembassy.gov deport* OR removal
