source_url,publisher_domain,headline,snippet,date_discovered,publisher_name,date_published,author_name,origin_country,destination_country,deportee_count,deportee_count_is_estimate,deportee_count_low,deportee_count_high,conducting_agency,transport_mode,cse_query
https://www.oig.dhs.gov/sites/default/files/assets/2019-03/OIG-19-27-Mar19.pdf,www.oig.dhs.gov,OIG-19-27 - Review of U.S. Coast Guard's Fiscal Year 2018 Drug ...,"Mar 8, 2019 ... The Coast Guard Maritime Law Enforcement program managers monitor the cocaine removal rate, watching for both changes in Coast Guard removals, ...",2025-08-30T16:26:07.862449Z,www.oig.dhs.gov,,Department of Homeland Security - Office of Inspector General,United States,,,False,,,DHS,unknown,site:dhs.gov (removal OR deport* OR repatriat*)
https://www.oig.dhs.gov/sites/default/files/assets/Mgmt/OIG_11-40_Feb11.pdf,www.oig.dhs.gov,OIG-11-40 - FEMA's Oversight and Management of Debris Removal ...,"Feb 3, 2011 ... Monitors can be local government employees or can be provided by a monitoring contractor. Any debris removal operation has three primary phases: ...",2025-08-30T16:26:07.862449Z,www.oig.dhs.gov,,"U.S. Department of Homeland Security, Office of Inspector General",United States,,26.0,True,11.0,40.0,DHS,unknown,site:dhs.gov (removal OR deport* OR repatriat*)
https://www.dhs.gov/archive/news/2023/04/27/fact-sheet-us-government-announces-sweeping-new-actions-manage-regional-migration,www.dhs.gov,Fact Sheet: U.S. Government Announces Sweeping New Actions to ...,"Apr 27, 2023 ... Individuals who unlawfully cross the U.S. Southwest border: will generally be processed under Title 8 expedited removal authorities in a matter ...",2025-08-30T16:26:09.881487Z,U.S. Department of Homeland Security,,,United States,,8.0,False,,,DHS,unknown,site:dhs.gov (removal OR deport* OR repatriat*)
https://www.dhs.gov/sites/default/files/2025-01/25_0123_er-and-parole-guidance.pdf,www.dhs.gov,Designating Aliens for Expedited Removal.,"Jan 23, 2025 ... The memorandum also authorizes DHS components to pause, modify, or terminate, effective immediately, any parole program that is inconsistent ...",2025-08-30T16:26:09.881487Z,www.dhs.gov,,0983959839@HQ.DHS.GOV,United States,,23.0,False,,,DHS,unknown,site:dhs.gov (removal OR deport* OR repatriat*)
https://www.dhs.gov/news/2025/03/15/dhs-launches-international-ad-campaign-warning-illegal-aliens-self-deport-and-stay,www.dhs.gov,DHS Launches International Ad Campaign Warning Illegal Aliens to ...,"Mar 15, 2025 ... President Trump has a clear message: if you are here illegally, we will find you and deport you. You will never return. But if you leave now ...",2025-08-30T16:26:09.881487Z,U.S. Department of Homeland Security,,,United States,,,False,,,DHS,unknown,site:dhs.gov (removal OR deport* OR repatriat*)
https://www.dhs.gov/news/2025/05/19/project-homecoming-charter-flight-brings-self-deporters-honduras-colombia,www.dhs.gov,Project Homecoming Charter Flight Brings Self-Deporters to ...,"May 19, 2025 ... DHS conducted a voluntary charter flight from Houston, TX, to Honduras and Colombia, bringing 64 participants who opted to self-deport back ...",2025-08-30T16:26:09.881487Z,U.S. Department of Homeland Security,,,United States,Honduras,19.0,False,,,DHS,charter_flight,site:dhs.gov (removal OR deport* OR repatriat*)
https://www.dhs.gov/hsi/newsroom,www.dhs.gov,News Releases and Statements | ICE,"May 16, 2025 ... |Enforcement and Removal. |. Video Available. ICE arrested Raul Enrique Pargas Rodriquez, a 31-year-old alien and foreign fugitive from ...",2025-08-30T16:26:09.881487Z,www.dhs.gov,2020-05-28T00:00:00,,United States,,16.0,False,,,ICE,unknown,site:dhs.gov (removal OR deport* OR repatriat*)
https://www.oig.dhs.gov/sites/default/files/assets/GrantReports/OIG_DD-07-10_Aug07.pdf,www.oig.dhs.gov,REview of Hurricane Katrina Debris Removal Actitivies St. Tammany ...,"Aug 20, 2007 ... Foxx & Company performed a review of ongoing Hurricane Katrina debris removal activities in St. Tammany Parish, Louisiana managed by the St ...",2025-08-30T16:26:09.881487Z,www.oig.dhs.gov,,DHS,United States,,20.0,False,,,DHS,unknown,site:dhs.gov (removal OR deport* OR repatriat*)
https://www.dhs.gov/news/2025/08/24/secretary-noem-announces-additional-28-million-support-north-carolina-recovery,www.dhs.gov,Secretary Noem announces an additional $28 million to support ...,"6 days ago ... This funding helps cover items like road repairs, critical infrastructure restoration, debris removal and other emergency actions taken to ...",2025-08-30T16:26:09.881487Z,U.S. Department of Homeland Security,,,United States,,,False,,,Department of Homeland Security,unknown,site:dhs.gov (removal OR deport* OR repatriat*)
https://www.oig.dhs.gov/sites/default/files/assets/Mgmt/OIGa_08-18_Mar10.pdf,www.oig.dhs.gov,"The Removal of a Canadian Citizen to Syria, OIG-08-18 Addendum ...","Mar 5, 2010 ... (U) The Department of Homeland Security (DHS) Office of Inspector General (OIG) was established by the Homeland Security Act of 2002 (Public ...",2025-08-30T16:26:09.881487Z,www.oig.dhs.gov,,U.S. Department of Homeland Security,United States,,13.0,True,8.0,18.0,ICE,unknown,site:dhs.gov (removal OR deport* OR repatriat*)
https://www.dhs.gov/news/2025/06/09/dhs-announces-it-will-forgive-failure-depart-fines-illegal-aliens-who-self-deport,www.dhs.gov,DHS Announces It Will Forgive Failure to Depart Fines for Illegal ...,"Jun 9, 2025 ... DHS announced illegal aliens who self-deport through the CBP Home App will receive forgiveness of any civil fines or penalties for failing ...",2025-08-30T16:26:09.881487Z,U.S. Department of Homeland Security,,,United States,,9.0,False,,,DHS,unknown,site:dhs.gov (removal OR deport* OR repatriat*)
https://www.dhs.gov/xlibrary/assets/s1-exercising-prosecutorial-discretion-individuals-who-came-to-us-as-children.pdf,www.dhs.gov,Exercising Prosecutorial Discretion with Respect to Individuals Who ...,"Jun 15, 2012 ... As a general matter, these individuals lacked the intent to violate the law and our ongoing review ofpending removal cases is already offering ...",2025-08-30T16:26:09.881487Z,www.dhs.gov,,"Department of Homeland Security, Secretary Janet Napolitano",United States,,,False,,,DHS,unknown,site:dhs.gov (removal OR deport* OR repatriat*)
https://www.dhs.gov/archive/news/2023/01/05/dhs-continues-prepare-end-title-42-announces-new-border-enforcement-measures-and,www.dhs.gov,DHS Continues to Prepare for End of Title 42; Announces New ...,"Jan 5, 2023 ... DHS is increasing and enhancing the use of expedited removal under Title 8 authorities for those who cannot be processed under the Title 42 ...",2025-08-30T16:26:12.233049Z,U.S. Department of Homeland Security,,,United States,,8.0,False,,,DHS,unknown,site:dhs.gov (removal OR deport* OR repatriat*)
https://www.oig.dhs.gov/sites/default/files/assets/2020-08/OIG-20-44-Jul20.pdf,www.oig.dhs.gov,OIG-20-44 - Pre-Disaster Debris Removal Contracts in Florida,"Aug 11, 2020 ... During our review, we identified debris removal contract performance issues and concerns. This report discusses observations regarding the use ...",2025-08-30T16:26:12.233049Z,www.oig.dhs.gov,,Department of Homeland Security - Office of Inspector General,United States,,32.0,True,20.0,44.0,DHS,unknown,site:dhs.gov (removal OR deport* OR repatriat*)
https://www.oig.dhs.gov/hotline,www.oig.dhs.gov,Hotline | Office of Inspector General,"What to Report to the DHS OIG Hotline. The DHS Office of Inspector General investigates fraud, waste, abuse, and criminal misconduct involving DHS programs, ...",2025-08-30T16:26:12.233049Z,www.oig.dhs.gov,,,United States,,,False,,,ICE,bus,site:dhs.gov (removal OR deport* OR repatriat*)
https://www.oig.dhs.gov/sites/default/files/assets/2017-11/OIG-18-08-Oct17.pdf,www.oig.dhs.gov,"OIG-18-08 - FEMA and California Need to Assist CalRecycle, a ...","Oct 30, 2017 ... Because CalRecycle's debris removal activities are primarily located within. Lake and Calaveras Counties (Counties), California has tasked these ...",2025-08-30T16:26:12.233049Z,www.oig.dhs.gov,,Department of Homeland Security - Office of Inspector General,United States,,30.0,False,,,DHS,unknown,site:dhs.gov (removal OR deport* OR repatriat*)
https://www.dhs.gov/keywords/enforcement-and-removal-operations-ero,www.dhs.gov,Enforcement and Removal Operations (ERO) | Homeland Security,"DHS announced ICE officers arrested removable criminal illegal aliens across the country on July 17, 2025, as part of coordinated enforcement targeting some of ...",2025-08-30T16:26:12.233049Z,U.S. Department of Homeland Security,,,United States,,,False,,,ICE,unknown,site:dhs.gov (removal OR deport* OR repatriat*)
https://www.oig.dhs.gov/reports/2021/ice-did-not-consistently-provide-separated-migrant-parents-opportunity-bring-their-children-upon-removal/oig-21-36-may21,www.oig.dhs.gov,ICE Did Not Consistently Provide Separated Migrant Parents the ...,"May 19, 2021 ... We determined that before July 12, 2018, migrant parents did not consistently have the opportunity to reunify with their children before removal.",2025-08-30T16:26:12.233049Z,www.oig.dhs.gov,,,United States,,,False,,,ICE,unknown,site:dhs.gov (removal OR deport* OR repatriat*)
https://go.dhs.gov/oTs?utm_campaign=8%2F14-20%2F2023%2Cero%2Cero23%2Cremoval%2C8%2F21-27%2F2023&utm_source=instagram&utm_medium=US+ICE,go.dhs.gov,"Archived: ICE conducts single adult, family unit removal flights Aug. 24","Jan 24, 2025 ... WASHINGTON — U.S. Immigration and Customs Enforcement (ICE), in coordination with the U.S. Department of Homeland Security (DHS) and U.S. ...",2025-08-30T16:26:12.233049Z,go.dhs.gov,2023-08-24T00:00:00,,United States,,24.0,False,,,ICE,unknown,site:dhs.gov (removal OR deport* OR repatriat*)
https://www.dhs.gov/archive/news/2024/07/02/dhs-conducts-removal-flight-china,www.dhs.gov,DHS Conducts Removal Flight to China | Homeland Security,"Jul 2, 2024 ... The US Department of Homeland Security (DHS), through US Immigration and Customs Enforcement (ICE), conducted a removal flight to the People's Republic of ...",2025-08-30T16:26:12.233049Z,U.S. Department of Homeland Security,,,United States,China,2.0,False,,,ICE,unknown,site:dhs.gov (removal OR deport* OR repatriat*)
https://go.dhs.gov/J77?utm_source=linkedin&utm_campaign=icons+%26+backgrounds%2C10.30-11.5.2023%2C6%2F12-18%2F2023%2Cremoval%2C2.+ero%2C1.8-14.2024%2C11.13-19.2023%2Ct42%2Cero23&utm_medium=U.S.+Immigration+and+Customs+Enforcement+%28ICE%29,go.dhs.gov,"Archived: ICE conducts single adult, family unit, removal flights ...","Mar 8, 2024 ... Those included removal flights to Albania, Georgia, Central America, Colombia, Dominican Republic, Ecuador, Mexico, Romania and Uzbekistan.",2025-08-30T16:26:12.233049Z,go.dhs.gov,2024-03-08T00:00:00,,United States,Albania,8.0,False,,,ICE,unknown,site:dhs.gov (removal OR deport* OR repatriat*)
https://www.dhs.gov/archive/news/2023/05/11/fact-sheet-circumvention-lawful-pathways-final-rule,www.dhs.gov,Fact Sheet: Circumvention of Lawful Pathways Final Rule ...,"May 11, 2023 ... ... removal. The rebuttable presumption may apply to migrants of any nationality who enter the United States at the southwest land border or ...",2025-08-30T16:26:12.233049Z,U.S. Department of Homeland Security,,,United States,,11.0,False,,,ICE,unknown,site:dhs.gov (removal OR deport* OR repatriat*)
https://go.dhs.gov/orc?utm_medium=wwwICEgov&utm_campaign=10.30-11.5.2023%2C2.+ero%2Cicons+%26+backgrounds%2Cremoval&utm_source=youtube,go.dhs.gov,"Archived: ICE conducts single adult, family unit removal flights Nov. 16","Jan 24, 2025 ... ICE Air Operations facilitates the transfer and removal of noncitizens, including family units, via commercial airlines and chartered flights.",2025-08-30T16:26:14.617747Z,go.dhs.gov,2023-11-16T00:00:00,,United States,,16.0,False,,,ICE,charter_flight,site:dhs.gov (removal OR deport* OR repatriat*)
https://go.dhs.gov/o7r?utm_campaign=2.+ero%2C8%2F14-20%2F2023%2C8%2F28-9%2F3%2F2023%2Cero23%2Cremoval%2Ct42&utm_source=facebook&utm_medium=Immigration+And+Customs+Enforcement+%28ICE%29,go.dhs.gov,"Archived: ICE conducts single adult, family unit removal flights Oct. 17","Jan 24, 2025 ... WASHINGTON — U.S. Immigration and Customs Enforcement (ICE), in coordination with the U.S. Department of Homeland Security (DHS) and U.S. ...",2025-08-30T16:26:14.617747Z,go.dhs.gov,2023-10-17T00:00:00,,United States,,17.0,False,,,ICE,unknown,site:dhs.gov (removal OR deport* OR repatriat*)
https://www.dhs.gov/publication/summary-crcls-recommendations-and-cbps-response-removal-mobility-device,www.dhs.gov,Summary of CRCL's Recommendations and CBP's Response ...,"Apr 10, 2025 ... Summary of CRCL's Recommendations and CBP's Response: Removal of Mobility Device ... This is a summary of CRCL's Recommendation Memorandum to CBP ...",2025-08-30T16:26:14.617747Z,U.S. Department of Homeland Security,,,United States,,,False,,,ICE,unknown,site:dhs.gov (removal OR deport* OR repatriat*)
https://studyinthestates.dhs.gov/2022/12/new-dhs-publishes-interim-final-rule-removal-of-obsolete-procedures-and-requirements,studyinthestates.dhs.gov,NEW: DHS Publishes Interim Final Rule: Removal of Obsolete ...,"On Dec. 12, 2022, the U.S. Department of Homeland Security (DHS) will amend its regulations at 8 CFR 214.1, 214.2, 214.3, 214.4, 214.12, and 214.13 to ...",2025-08-30T16:26:14.617747Z,studyinthestates.dhs.gov,,,United States,,12.0,False,,,DHS,unknown,site:dhs.gov (removal OR deport* OR repatriat*)
https://www.dhs.gov/xlibrary/assets/privacy/privacy_pia_ice_eidupdate-15c.pdf,www.dhs.gov,Enforcement INtegrated Database (EID) Update 015(c),"Nov 7, 2011 ... Module, ENFORCE Alien Detention Module, and ENFORCE Alien Removal Module. Collectively these applications are referred to as the “ENFORCE ...",2025-08-30T16:26:14.617747Z,www.dhs.gov,,U.S. Department of Homeland Security,United States,,,False,,,DHS,unknown,site:dhs.gov (removal OR deport* OR repatriat*)
https://go.dhs.gov/oeZ?utm_source=instagram&utm_medium=US+ICE&utm_campaign=2.+ero%2C8%2F14-20%2F2023%2C8%2F28-9%2F3%2F2023%2Cero23%2Cremoval,go.dhs.gov,"Archived: ICE conducts single adult, family unit removal flights Oct. 6 ...","Jan 24, 2025 ... WASHINGTON — U.S. Immigration and Customs Enforcement (ICE), in coordination with the U.S. Department of Homeland Security (DHS) and U.S. ...",2025-08-30T16:26:14.617747Z,go.dhs.gov,2023-10-06T00:00:00,,United States,,6.0,False,,,ICE,unknown,site:dhs.gov (removal OR deport* OR repatriat*)
https://www.oig.dhs.gov/sites/default/files/assets/2018-02/OIG-18-43-Jan18.pdf,www.oig.dhs.gov,OIG-18-43 - Review of U.S. Coast Guard's Fiscal Year 2017 Drug ...,"Jan 30, 2018 ... Cocaine Removal Rate: Removal rate for cocaine from non-commercial vessels in the maritime. Transit Zone. NOTE: In accordance with ONDCP ...",2025-08-30T16:26:14.617747Z,www.oig.dhs.gov,,Department of Homeland Security - Office of Inspector General,United States,,2017.0,False,,,DHS,ship,site:dhs.gov (removal OR deport* OR repatriat*)
https://www.dhs.gov/xlibrary/assets/mgmt/itpa-ice-drom2010.pdf,www.dhs.gov,ICE- Detention & Removal Operations Modernization (DROM ...,Review. The DHS Chief Information Officer conducted a comprehensive program review of the ICE Detention &. Removal Operations Modernization (DROM) Program ...,2025-08-30T16:26:14.617747Z,www.dhs.gov,,Department of Homeland Security,United States,,,False,,,ICE,unknown,site:dhs.gov (removal OR deport* OR repatriat*)
https://go.dhs.gov/4ss?utm_medium=ICE&utm_campaign=ero%2C5%2F8-14%2F2023%2Ct42&utm_source=twitter,go.dhs.gov,"Archived: ICE announces additional enforcement, removal actions ...","May 11, 2023 ... ICE conducted multiple removal flights on Wednesday, including to Colombia, Cuba, Guatemala and Honduras, as part of dozens of flights conducted each week.",2025-08-30T16:26:14.617747Z,go.dhs.gov,2023-05-11T00:00:00,,United States,Colombia,11.0,False,,,ICE,unknown,site:dhs.gov (removal OR deport* OR repatriat*)
https://ohss.dhs.gov/khsm/dhs-repatriations,ohss.dhs.gov,DHS Repatriations | OHSS,Voluntary returns: Returns granted to aliens encountered at the border instead of immigration removal proceedings. This is a subset of enforcement returns.,2025-08-30T16:26:14.617747Z,Office of Homeland Security Statistics,,,United States,,,False,,,ICE,ship,site:dhs.gov (removal OR deport* OR repatriat*)
https://www.dhs.gov/hsi/contact,www.dhs.gov,Contact | ICE,"Aug 14, 2025 ... Removal · Recalcitrant Countries · Self-Deportation · Immigration Enforcement Frequently Asked Questions · ERO Statistics Dashboard. ICE ERO ...",2025-08-30T16:26:16.795986Z,www.dhs.gov,2020-08-06T00:00:00,,United States,,14.0,False,,,ICE,unknown,site:dhs.gov (removal OR deport* OR repatriat*)
https://go.dhs.gov/o92?utm_source=instagram&utm_campaign=10.30-11.5.2023%2C2.+ero%2Cremoval%2Cicons+%26+backgrounds&utm_medium=US+ICE,go.dhs.gov,"Archived: ICE conducts single adult, family unit removal flights Dec. 1","Jan 24, 2025 ... ICE Air Operations facilitates the transfer and removal of noncitizens, including family units, via commercial airlines and chartered flights in ...",2025-08-30T16:26:16.795986Z,go.dhs.gov,2023-12-01T00:00:00,,United States,,1.0,False,,,ICE,charter_flight,site:dhs.gov (removal OR deport* OR repatriat*)
https://go.dhs.gov/oAb?utm_source=instagram&utm_campaign=2.+ero%2C8%2F14-20%2F2023%2C8%2F28-9%2F3%2F2023%2Cero23%2Cremoval&utm_medium=US+ICE,go.dhs.gov,"Archived: ICE conducts single adult, family unit removal flights Sept. 27","Jan 24, 2025 ... In fiscal year 2022, ICE's Enforcement and Removal Operations conducted 72,177 removals to more than 150 countries worldwide. B-roll for removal ...",2025-08-30T16:26:16.795986Z,go.dhs.gov,2023-09-27T00:00:00,,United States,,27.0,False,,,ICE,unknown,site:dhs.gov (removal OR deport* OR repatriat*)
https://www.dhs.gov/archive/immigration-action,www.dhs.gov,Immigration Action | Homeland Security,"Aug 1, 2024 ... Executive Actions · Strengthen Border Security · Revise Removal Priorities · End Secure Communities and Replace it with New Priority Enforcement ...",2025-08-30T16:26:16.795986Z,U.S. Department of Homeland Security,,,United States,,,False,,,Department of Homeland Security,unknown,site:dhs.gov (removal OR deport* OR repatriat*)
https://www.dhs.gov/archive/news/2024/07/01/united-states-signs-arrangement-panama-implement-removal-flight-program,www.dhs.gov,United States Signs Arrangement with Panama to Implement ...,"Jul 1, 2024 ... The removal flight program is part of the comprehensive regional approach to address irregular migration. Due to the unique mission set, DHS ...",2025-08-30T16:26:16.795986Z,U.S. Department of Homeland Security,,,United States,,1.0,False,,,DHS,unknown,site:dhs.gov (removal OR deport* OR repatriat*)
https://go.dhs.gov/ZDK?utm_source=facebook&utm_campaign=1%2F30-2%2F5%2F2023&utm_medium=Immigration+And+Customs+Enforcement+%28ICE%29,go.dhs.gov,Criminal Alien Program | ICE,"Jan 27, 2025 ... CAP focuses on the identification, arrest, and removal of Incarcerated aliens at federal, state, and local levels, as well as at-large criminal aliens.",2025-08-30T16:26:16.795986Z,go.dhs.gov,2020-03-16T00:00:00,,United States,,,False,,,ICE,unknown,site:dhs.gov (removal OR deport* OR repatriat*)
https://ohss.dhs.gov/topics/immigration/immigration-enforcement/monthly-tables,ohss.dhs.gov,Immigration Enforcement and Legal Processes Monthly Tables | OHSS,"When we send an alien back to their country of citizenship or a third country, it's called repatriation. It can be a removal (which carries administrative ...",2025-08-30T16:26:16.795986Z,Office of Homeland Security Statistics,,,United States,,,False,,,ICE,ship,site:dhs.gov (removal OR deport* OR repatriat*)
https://go.dhs.gov/JoZ?utm_source=facebook&utm_medium=Immigration+And+Customs+Enforcement+%28ICE%29&utm_campaign=10.30-11.5.2023%2C2.+ero%2Cicons+%26+backgrounds%2Cremoval,go.dhs.gov,"Archived: ICE conducts single adult, family unit removal flights Dec. 20","ICE Air Operations facilitates the transfer and removal of noncitizens, including family units, via commercial airlines and chartered flights in support of ICE ...",2025-08-30T16:26:16.795986Z,go.dhs.gov,2023-12-20T00:00:00,,United States,,20.0,False,,,ICE,charter_flight,site:dhs.gov (removal OR deport* OR repatriat*)
https://go.dhs.gov/ovB?utm_source=twitter&utm_campaign=10.30-11.5.2023%2C2.+ero%2Cicons+%26+backgrounds%2Cremoval&utm_medium=ICE,go.dhs.gov,"Archived: ICE conducts single adult, family unit removal flights Dec. 13","Jan 24, 2025 ... ICE, working in coordination with DHS and CBP, facilitated removal flights, including single adults and family units to Central America, ...",2025-08-30T16:26:16.795986Z,go.dhs.gov,2023-12-13T00:00:00,,United States,,13.0,False,,,ICE,unknown,site:dhs.gov (removal OR deport* OR repatriat*)
https://go.dhs.gov/JNn?utm_source=linkedin&utm_medium=U.S.+Immigration+and+Customs+Enforcement+%28ICE%29&utm_campaign=1.8-14.2024%2C10.30-11.5.2023%2C2.+ero%2Cicons+%26+backgrounds%2Cremoval%2C6%2F12-18%2F2023%2Ct42,go.dhs.gov,"Archived: ICE conducts single adult, family unit removal flights Feb. 2","Jan 24, 2025 ... ICE, working in coordination with DHS and CBP, facilitated removal flights, including single adults and family units to Central America, ...",2025-08-30T16:26:16.795986Z,go.dhs.gov,2024-02-02T00:00:00,,United States,,2.0,False,,,ICE,unknown,site:dhs.gov (removal OR deport* OR repatriat*)
https://go.dhs.gov/ohK?utm_source=instagram&utm_campaign=2.+ero%2C8%2F14-20%2F2023%2C8%2F28-9%2F3%2F2023%2Cero23%2Cremoval%2Ct42&utm_medium=US+ICE,go.dhs.gov,"Archived: ICE conducts single adult, family unit removal flights Oct. 13","Jan 24, 2025 ... ICE Air Operations facilitates the transfer and removal of noncitizens, including family units, via commercial airlines and chartered flights.",2025-08-30T16:26:18.937448Z,go.dhs.gov,2023-10-13T00:00:00,,United States,,13.0,False,,,ICE,charter_flight,site:dhs.gov (removal OR deport* OR repatriat*)
https://go.dhs.gov/JgZ?utm_source=facebook&utm_campaign=1.8-14.2024%2C10.30-11.5.2023%2C2.+ero%2C6%2F12-18%2F2023%2Cicons+%26+backgrounds%2Cremoval%2Ct42%2Cero23&utm_medium=Immigration+And+Customs+Enforcement+%28ICE%29,go.dhs.gov,"Archived: ICE conducts single adult, family unit removal flights Feb. 9","Feb 9, 2024 ... ICE, working in coordination with DHS and CBP, facilitated removal flights, including single adults and family units to Bangladesh, ...",2025-08-30T16:26:18.937448Z,go.dhs.gov,2024-02-09T00:00:00,,United States,Bangladesh,9.0,False,,,ICE,unknown,site:dhs.gov (removal OR deport* OR repatriat*)
https://www.dhs.gov/sites/default/files/publications/ice_-_removal_of_aliens_claiming_u.s.-born_children_second_half_cy_2018_0.pdf,www.dhs.gov,Removal of Aliens Claiming US-Born Children,"Sep 27, 2019 ... ICE's Enforcement and Removal Operations (ERO) deportation officers enforce the Nation's immigration laws by identifying and arresting removable ...",2025-08-30T16:26:18.937448Z,www.dhs.gov,,DHS-ICE,United States,,27.0,False,,,ICE,unknown,site:dhs.gov (removal OR deport* OR repatriat*)
https://www.dhs.gov/sites/default/files/publications/17_0220_S1_Implementing-the-Presidents-Border-Security-Immigration-Enforcement-Improvement-Policies.pdf,www.dhs.gov,Implementing the President's Border Security and Immigration ...,"Jan 25, 2017 ... It implements new policies designed to stem illegal immigration and facilitate the detection, apprehension, detention, and removal of aliens who ...",2025-08-30T16:26:18.937448Z,www.dhs.gov,,DHS Office of Public Affairs,United States,,,False,,,DHS,unknown,site:dhs.gov (removal OR deport* OR repatriat*)
https://go.dhs.gov/JT9?utm_campaign=1.8-14.2024%2C10.30-11.5.2023%2C2.+ero%2Cicons+%26+backgrounds%2Cremoval&utm_medium=wwwICEgov&utm_source=youtube,go.dhs.gov,"Archived: ICE conducts single adult, family unit removal flights Jan. 19","Jan 19, 2024 ... ICE, working in coordination with DHS and CBP, facilitated removal flights, including single adults and family units to Central America, ...",2025-08-30T16:26:18.937448Z,go.dhs.gov,2024-01-19T00:00:00,,United States,,19.0,False,,,ICE,unknown,site:dhs.gov (removal OR deport* OR repatriat*)
https://www.dhs.gov/keywords/removal,www.dhs.gov,Removal | Homeland Security,"DHS announced ICE dismantled a violent, criminal illegal alien-run massive human trafficking ring in Nebraska. Last Updated: August 15, 2025 | Press Releases ...",2025-08-30T16:26:18.937448Z,U.S. Department of Homeland Security,,,United States,,,False,,,ICE,unknown,site:dhs.gov (removal OR deport* OR repatriat*)
https://www.dhs.gov/sites/default/files/publications/immigration-system_0.pdf,www.dhs.gov,Fact Sheet,"Jun 15, 2012 ... As the Department of Homeland Security. (DHS) continues to focus its enforcement resources on the removal of individuals who pose a national ...",2025-08-30T16:26:18.937448Z,www.dhs.gov,,Matthew.Chandler,United States,,,False,,,DHS,unknown,site:dhs.gov (removal OR deport* OR repatriat*)
https://go.dhs.gov/JZB?utm_campaign=10.30-11.5.2023%2C2.+ero%2Cicons+%26+backgrounds%2Cremoval&utm_medium=US+ICE&utm_source=instagram,go.dhs.gov,"Archived: ICE conducts single adult, family unit removal flights Dec. 15","Jan 24, 2025 ... ICE Air Operations facilitates the transfer and removal of noncitizens, including family units, via commercial airlines and chartered flights.",2025-08-30T16:26:18.937448Z,go.dhs.gov,2023-12-15T00:00:00,,United States,,15.0,False,,,ICE,charter_flight,site:dhs.gov (removal OR deport* OR repatriat*)
